<?xml version="1.0"?>
<!DOCTYPE menu SYSTEM "courses.dtd">
<term>
    <set program="ACIT" set="1 A">
        <day code="Fri">
            <course crn="44279">
                <name>ACIT1420</name>
                <type>A</type>
                <times start="830" end="1120"></times>
                <instructor>"Zhang, Lei"</instructor>
                <dates start="05 Sep 2018" end="07 Dec 2018"></dates>
                <max>25</max>
                <act>25</act>
                <hrs>2.83</hrs>
            </course>
        </day>
    </set>
</term>